{
  "additionalProperties": false,
  "properties": {
    "synthetic": {
      "const": true,
      "title": "Synthetic",
      "type": "boolean"
    },
    "platform": {
      "enum": [
        "antibody",
        "small_molecule",
        "oligonucleotide"
      ],
      "title": "Platform",
      "type": "string"
    },
    "status": {
      "enum": [
        "ACCEPTED_FOR_REVIEW",
        "NEEDS_INFORMATION",
        "DECLINED"
      ],
      "title": "Status",
      "type": "string"
    },
    "reason": {
      "minLength": 1,
      "title": "Reason",
      "type": "string"
    },
    "missing_information": {
      "items": {
        "type": "string"
      },
      "title": "Missing Information",
      "type": "array"
    },
    "next_action": {
      "minLength": 1,
      "title": "Next Action",
      "type": "string"
    },
    "next_owner_role": {
      "minLength": 1,
      "title": "Next Owner Role",
      "type": "string"
    },
    "delivery_mode": {
      "const": "local_simulation",
      "title": "Delivery Mode",
      "type": "string"
    }
  },
  "required": [
    "synthetic",
    "platform",
    "status",
    "reason",
    "missing_information",
    "next_action",
    "next_owner_role",
    "delivery_mode"
  ],
  "title": "SpecialistResponseTemplate",
  "type": "object",
  "$schema": "https://json-schema.org/draft/2020-12/schema"
}
